"site_name","url","question","answer","category","internal_link","link"
"Airbnb FAQ","https://www.airbnb.com/resources/hosting-homes/a/preparing-your-spaceand-your-guestsfor-emergencies-134","Preparing your space—and your guests—for emergencies","Home Plan ahead with these tips from global health and safety organizations. By Airbnb on Mar 5, 2020 As a host, you have a lot to remember and unless you make an effort to focus on home safety, things can get overlooked. From staying on top of basic tasks like replacing batteries to sharing an evacuation plan with your guests, we know how important it is for you to stay prepared in case of a fire, natural disaster, or other emergency. We've compiled some tips from the Global Disaster Preparedness Center, the American Red Cross, and other health and safety organizations, but it's a good idea to familiarize yourself with any rules and regulations specific to your region. Install smoke and carbon monoxide alarms You may already know about the dangers of a fire, but what about the threat of carbon monoxide (CO)? Many common household appliances—like gas stoves, water heaters, ovens, furnaces, and charcoal grills—can emit CO. The invisible, odorless, colorless gas can be dangerous and even lethal, according to the Centers for Disease Control and Prevention (CDC). Without proper inspection and ventilation, these appliances can cause dangerous gas buildup that can lead to serious health issues and even death. Help prevent CO poisoning by installing alarms near every sleeping area, as the CDC suggests. You can help prevent fires by installing smoke alarms on every level of your space and outside each sleeping area at a minimum, according to the American Red Cross. You can also buy combination alarms that work for smoke and CO. Be sure to update the amenities section of your listing description to let potential guests know that you've taken these steps to protect their safety. Help your guests understand the danger of CO poisoning Once you've installed carbon monoxide alarms, it's a good idea to familiarize yourself with the common sources of carbon monoxide and the telltale signs of CO poisoning: Signs of carbon monoxide poisoning include headaches, weakness, dizziness, nausea, and vomiting. If you or your guests experience these and you suspect CO poisoning, the CDC recommends that you exit the building immediately and call 911. Your house manual is a great place to remind guests about why they should never use a grill or camp stove indoors, which includes garages and basements. This reminder is especially important in climates where your guests may be tempted to use stoves or ovens for warmth. You can explain the dangers of CO, and be sure to provide reliable sources of heat. In your house manual, you can communicate that if the CO alarm sounds, guests should follow a recommended safety protocol, like going outdoors immediately or moving near an open window or door if they can't get outside. Note: Some homes that don't have any fuel-burning appliances (i.e. homes that run entirely on electric) may not need CO alarms, but it's a good idea to contact your local fire department's non-emergency number to confirm. Build a maintenance schedule into your hosting routine Test your smoke and carbon monoxide alarms regularly. The CDC recommends checking or replacing the batteries when you change the time on your clocks each spring and fall. Most alarms should be replaced every five to 10 years, but check the manufacturer's instructions","NA","0","NA"
"Airbnb FAQ","https://www.airbnb.com/resources/hosting-homes/a/how-search-works-on-airbnb-460","How search works on Airbnb","Home Get tips for improving your ranking in search results. By Airbnb on May 11, 2022 Updated Nov 21, 2022 You've created and published your listing, and now you want people to check it out. How do they find it? Here are a few things you can do to improve your search ranking. Understand the basics Airbnb's search algorithm uses many factors to determine the order listings appear in search results. Not every factor is weighed equally. The price, quality, and popularity of a listing heavily influence how a listing shows up. The algorithm prioritizes the total price of a listing before taxes (including fees and discounts), and the quality of a listing, compared to similar listings in the area. A listing's photos, guest reviews, and other characteristics can help determine its quality. Setting a competitive price and maintaining high quality can help improve your ranking, because listings offering the best value in any given region tend to rank higher in search results. Strive for popularity Airbnb's algorithm evaluates your listing's popularity using a wide range of info. This includes how often guests book your listing, visit your listing page, and add your listing to their wish lists. More popular listings tend to rank higher in search results. To help spark guests' interest, we recommend that you: Offer amenities guests want, such as high-speed wifi, self check-in, and free parking. Describe the unique characteristics of your space with specific details that let guests know exactly what to expect. Feature high-quality photos that set an inviting scene. High-quality photos may improve your prominence within a category. Open more availability Airbnb's algorithm factors in your listing's availability, your response times to inquiries, and how often you accept reservations. The more open dates you offer on your calendar, the more likely your listing will meet a guest's search criteria and appear in their search results. Actions you can take to improve your listing's search ranking: Respond to reservation requests within 24 hours. Avoid frequently declining reservation requests. Use Instant Book, so guests can find your listing when they filter their search results for that option. This feature lets guests book your place instantly (without the need for you to accept their requests), speeding up your response times. Reduce the number of restrictions, like the minimum and maximum length of stays, you put on bookings. Offer great hospitality Your ability to set guest expectations in your listing description, then meet or exceed them as a Host, typically improves your search ranking over time. Providing accurate details about your place and clearly communicating with guests can lead to higher ratings and reviews of their stays with you. It can also help you avoid customer service complaints, which can negatively affect your listing's ranking. The algorithm also considers whether you're a Superhost—our term for a highly rated, experienced Host—or if you're meeting some or all of the requirements to become one. The requirements include things like responding quickly to guest booking inquiries and keeping cancellations (by you) to a minimum. Guests have the option to filter their search results to access only listings offered by Superhosts. Discover more in our guide to setting up a successful listing Update your listing Information contained in this article may have changed since publication. Highlights Your listing's price, quality, and popularity affect how it shows up in guests' search results Try opening more dates on your calendar to match more guests' search criteria Airbnb May 11, 2022 Was this helpful? You might also like How to set up an effective listing page Share key details and use compelling photos. Guidelines for writing your listing title Update your title to showcase your space in search results. How to take great photos for your listing Get your place ready, use your phone as a camera, and add details and captions.","NA","1","A clear and simple checkout - Resource Center - Airbnb, Writing an effective listing description - Resource Center - Airbnb, How to take great photos for your listing - Resource Center - Airbnb, Discover more in our guide to setting up a successful listing, Log In / Sign Up - Airbnb, How to set up an effective listing page Share key details and use compelling photos., Guidelines for writing your listing title Update your title to showcase your space in search results., use your phone as a camera, and add details and captions."
"Airbnb FAQ","https://www.airbnb.com/resources/hosting-homes/a/plan-ahead-for-weather-emergencies-684","Plan ahead for weather emergencies","Home Prepare your guests and your space for hurricanes, tornadoes, and extreme heat. By Airbnb on Jun 26, 2024 Updated Aug 8, 2024 Being prepared for severe weather helps protect you, your guests, and your property. The health-focused relief and development organization Americares offers these tips for supporting guests and reducing property damage during hurricanes, tornadoes, and heat waves. Supporting guests Guests may be unfamiliar with the local climate and what to do in a weather emergency. Here are some ways to support them, according to Americares. Write down or print out important information and leave it in a prominent place. Emergency contacts: List phone numbers for police, fire, and ambulance services along with the national emergency line (such as 911, 999, or 112). Property address: Provide your place's full street address, major cross streets or landmarks, and the name of the neighborhood, district, or zone. Storm shelter: Note where to shelter in place during a tornado or hurricane, like the basement or an interior room with no windows or skylights. Map of the area: Identify potential evacuation routes, community evacuation shelters, and cooling centers. Note which locations allow pets. Account for seasonal weather in your listing, messages, and cancellation policy. House rules: Add basic details about the area's seasonal weather. For example, “Hurricane season is usually from June to November. Please follow weather reports and instructions issued by local officials.” Quick replies and scheduled messages: Use the tools in your Messages tab to save tips you can share when severe weather is forecast. For example, you could create a quick reply suggesting where to cool down during a heat wave. Cancellation policy: Severe weather may pose additional hazards for places without air conditioning and unique stays like campers, tents, and treehouses. Offering a flexible cancellation policy gives guests more leeway to plan around forecasts. The cancellation policy you select for your listing generally determines guest refunds for canceled reservations, unless you and the guest agree otherwise. If a large-scale event at the reservation location prevents or legally prohibits a reservation from being completed, Airbnb's Major Disruptive Events Policy may apply. When the Major Disruptive Events Policy applies, you can cancel a reservation without fees or adverse consequences, and the listing's calendar will be blocked for those dates. Guests with impacted reservations can also cancel and receive a full refund. If you or your guests cancel a reservation that's covered by the policy, you will not receive a payout. Communicating with guests Americares suggests messaging your guests about weather advisories. You can remind them of local resources and share tips for protecting themselves during their stay. Messaging guests about hurricanes Messaging guests about tornadoes Messaging guests about extreme heat Reducing property damage Weather-resistant improvements can help reduce property damage during a hurricane or tornado and make your place more comfortable during a heat wave. Americares recommends these steps for maintaining and securing your place. Preparing for hurricanes Preparing for tornadoes Preparing for extreme heat Information contained in this article may have changed since publication. Airbnb Jun 26, 2024 Was this helpful? You might also like How Airbnb protects hosts Host with confidence with our policies and protections. Understanding Instant Book Instant Book can simplify the booking process and help your listing stand out. How you'll get paid for hosting Learn the basics about when and how you'll receive payment.","NA","1","Log In / Sign Up - Airbnb, flexible cancellation policy, Major Disruptive Events Policy - Airbnb Help Center, How Airbnb protects hosts Host with confidence with our policies and protections., Understanding Instant Book Instant Book can simplify the booking process and help your listing stand out., How you'll get paid for hosting Learn the basics about when and how you'll receive payment."
"Airbnb FAQ","https://www.airbnb.com/resources/hosting-homes/a/how-to-prepare-your-space-and-guests-for-wildfires-542","How to prepare your space and guests for wildfires","Home These expert tips can help you reduce risks and educate guests about safety. By Airbnb on Aug 5, 2022 Updated Aug 8, 2024 We take the safety of Hosts and guests seriously. Our Trust & Safety Advisory Coalition partnered with the International Association of Fire Chiefs (IAFC) to share these resources from its Ready, Set, Go! program. Though the program is US-based, its tips are relevant in many places affected by wildfires worldwide. Here are a few of the IAFC's suggestions for reducing risks and educating guests about wildfire safety. Reducing wildfire risks Planning ahead can help protect you, your guests, and your property. The IAFC suggests taking these steps: Remove overgrown vegetation within 30 feet (9 meters) of your house, garage, and other buildings on your property to help create defensible space. Use hard surfaces—like concrete, rock, or pavers—5 feet (1.5 meters) around the base of your home. Use fire-resistant, low-growing, herbaceous vegetation when planting in areas close to your home. Remove low-hanging branches to create at least 6 feet (2 meters) of distance between grasses, shrubs, and taller trees. Sign up for emergency alerts in your property's location to stay informed. Many local, regional, and national government agencies offer this service. Check their websites for details. Educating guests about wildfire safety Guests traveling from places that aren't typically affected by wildfires may not understand the risks. You can help them be prepared with these tips from the IAFC: Add basic information about the area's wildfire season and burn restrictions to your house rules. Display a list of local emergency contacts somewhere prominent in your space, like on the fridge or coffee table. Give guests a map of the area that clearly shows your property's address, nearby road names, multiple evacuation routes, and potential safe locations. Include the name of your neighborhood. Encourage guests to sign up for local emergency alerts and stay updated on fire activity, even if a wildfire isn't near your property. Let guests know they don't need to wait for an evacuation order to leave. They may need extra time to navigate the area if it's unfamiliar to them. For more resources about preparing for wildfires, you can reach out to your local fire department. If you're in the US, you can also check out Ready, Set, Go! to understand more about wildfires and create an action plan. Handling cancellations The cancellation policy you select for your listing generally determines guest refunds for canceled reservations, unless you and the guest agree otherwise. If a large-scale event at the reservation location prevents or legally prohibits a reservation from being completed, Airbnb's Major Disruptive Events Policy may apply. When the Major Disruptive Events Policy applies, you can cancel a reservation without fees or adverse consequences, and the listing's calendar will be blocked for those dates. Guests with impacted reservations can also cancel and receive a full refund. If you or your guests cancel a reservation that's covered by the policy, you will not receive a payout. Information contained in this article may have changed since publication. Airbnb Aug 5, 2022 Was this helpful? You might also like Tips to help prevent parties at your property Get details about the global party ban and strategies for avoiding problems. How search works on Airbnb Get tips for improving your ranking in search results. How Airbnb protects hosts Host with confidence with our policies and protections.","NA","1","Ready, Major Disruptive Events Policy - Airbnb Help Center, Tips to help prevent parties at your property - Resource Center - Airbnb, How search works on Airbnb - Resource Center - Airbnb, Tips to help prevent parties at your property Get details about the global party ban and strategies for avoiding problems., How search works on Airbnb Get tips for improving your ranking in search results., How Airbnb protects hosts Host with confidence with our policies and protections."
"Airbnb FAQ","https://www.airbnb.com/resources/hosting-homes/a/what-happens-when-guests-cancel-or-change-a-booking-426","What happens when guests cancel or change a booking?","Home Here's what to expect with your payout when trip plans change. By Airbnb on Jul 19, 2021 Updated Aug 24, 2022 Life is uncertain, and guests sometimes have to cancel or change their reservations. You may still receive payment—or what we call a payout—even if a guest cancels, depending on your cancellation policy and how far in advance guests cancel. Here's exactly what to expect if your guests cancel or change their booking, or if they request a partial refund. When a guest cancels their reservation If a guest cancels their booking, your cancellation policy applies. If you're owed a payout, the money will typically be sent to you 24 hours after your guest's scheduled check-in time. For example, if you have a firm cancellation policy, and your guest cancels less than seven days before check-in, you'll be paid 100% of your nightly price for all nights, minus any taxes and fees. We'll send this 24 hours after your guest's scheduled check-in time. You won't receive a cleaning, pet, or extra guest fee if your guest doesn't check in. You'll always be able to find a record of any payouts or adjustments in your transaction history. Learn more about how you get paid When a guest changes their reservation If a guest alters their booking, we'll typically send payment 24 hours after their new check-in time. If you're hosting longer stays, you'll receive a monthly payout for these reservations. For example, if you approve a change request for a guest to come for 10 days in August instead of 10 days in June, and they change with enough time that your cancellation policy doesn't apply, we'll send your payout 24 hours after your guest's new check-in time. If a guest changes their reservation while they're at your place, your future payouts may be affected. For example, if a guest checks in to your place for a 20-day reservation, we'd send your payout 24 hours after their check-in time. But if they have to cancel and leave on day 10, and you have a flexible cancellation policy, you'd be entitled to payment for each night they stay, plus one additional night. In this case, since you would've already received your full payout, your future payouts will be adjusted to cover the cost of the partial refund. When a guest requests a refund If a guest checks in to your place expecting an amenity, but it's missing or broken, they might ask for a partial refund. For example, if your hot tub is unexpectedly broken, and it's a main feature of your villa, your guest may contact you to request a partial refund. For this example as well, if you agree to a partial refund, your future payouts will be adjusted to cover the cost of the partial refund, since you would've already received your full payout. You may also reimburse guests through the Resolution Center. If you send payment that way, your future payouts wouldn't be affected. Protecting yourself from cancellations Of course, you can't control whether a guest has to cancel or change their reservation. But you can be sure you're comfortable with your settings by reading more about our guest cancellation policies and choosing the right one for you. It's also a great idea to do regular maintenance and communicate with guests at important moments, so you can be confident that your place will be ready to welcome guests—and you'll be able to help if anything goes wrong. Update your cancellation policy Information contained in this article may have changed since publication. Highlights If a guest cancels a booking, your cancellation policy applies If you approve a change in a guest's booking, you'll be paid 24 hours after their new check-in time Choose which cancellation policy works for you Airbnb Jul 19, 2021 Was this helpful? You might also like Choose the right cancellation policy for you Find a policy that works for you and your hosting needs. Avoiding cancellations Update your calendar, adjust your settings, and know your responsibilities. Managing your calendar Update your booking settings to avoid canceling reservations.","NA","1","If your guest cancels their reservation - Airbnb Help Center, Cancellation policies for your home - Airbnb Help Center, Airbnb service fees - Airbnb Help Center, Log In / Sign Up - Airbnb, How you'll get paid for hosting - Resource Center - Airbnb, Setting a price for longer stays - Resource Center - Airbnb, Payouts for monthly stays - Airbnb Help Center, Change the dates of your home reservation - Airbnb Help Center, Canceling during your stay - Airbnb Help Center, Request a partial or full refund from your home host - Airbnb Help Center, Home - Resource Center - Airbnb, Communicate effectively - Resource Center - Airbnb, Update your cancellation policy, Tips for avoiding preventable cancellations - Resource Center - Airbnb, Manage your calendar - Resource Center - Airbnb, and know your responsibilities., Managing your calendar Update your booking settings to avoid canceling reservations."
