"site_name","url","question","answer","category","internal_link","link"
"Notion","https://www.notion.com/templates/category/faqs","Does Notion support project templates for different industries?","Yes, Notion offers project templates for various industries, from software and marketing to construction and education. Each template can be customized to fit industry-specific workflows while maintaining core project management principles.","NA","0","NA"
"Notion","https://www.notion.com/templates/category/faqs","Do Notion project management tools allow custom workflow creation?","Yes. Notion's composable approach lets you create custom workflows tailored to your team's needs, combining different views and properties that can evolve as your projects change.","NA","0","NA"
"Notion","https://www.notion.com/templates/category/faqs","What does ""composable project management"" mean?","It's the idea of building your system from modular parts that can be reconfigured as needs change. Your project management tool, built by you, for you.","NA","0","NA"
"Notion","https://www.notion.com/templates/category/faqs","Is Notion good for project management?","Yes. Teams use Notion to manage plans, tasks, timelines, docs, and status updates in one place. Because templates are composable, you can tailor workflows (Agile, Waterfall, hybrid) without duct'taping multiple tools together. Competitors offer templates too, but Notion's linked databases keep everything connected.","NA","0","NA"
"Notion","https://www.notion.com/templates/category/faqs","What project management templates should I start with?","Start with a project plan, timeline (Gantt), WBS, RACI, and a weekly status report. These together cover the four fundamentals of any project: scope, schedule, ownership, and communication.","NA","0","NA"
"Notion","https://www.notion.com/templates/category/faqs","Can I manage Agile projects in Notion?","Yes. Use a backlog and sprint board (Kanban), plus a timeline for capacity planning. Add retrospectives and a change log to complete the loop.","NA","0","NA"
"Notion","https://www.notion.com/templates/category/faqs","How do Notion templates compare to spreadsheets or docs?","Templates in spreadsheets are quick, but they're usually static. Notion templates create databases you can relate, filter, and visualize (board, timeline, calendar), with the flexibility to adapt as projects grow. Notion lets you bring docs, tasks, and wiki together in one space. No more SaaS sprawl!","NA","0","NA"
"Adobe","https://helpx.adobe.com/acrobat/faq.html","What is Adobe Acrobat Studio?","Adobe Acrobat Studio is a subscription plan that transforms digital documents into powerful workspaces to help you do your best work. Your subscription includes access to all PDF tools and products, including Acrobat Pro, Acrobat AI Assistant, and Adobe Express Premium. Use Acrobat Studio to: Uncover insights across a range of file types uploaded, from PDFs to Microsoft 365 files and web links. Validate AI responses with citations in PDF Spaces. Generate new ideas, answer questions, and get next steps with customizable assistants in an AI-powered workspace. Create professional content using templates, brand kits, and image & video editing tools. Share PDF Spaces with personalized AI Assistant to help teams and clients get up to speed. To purchase Acrobat Studio, contact support, sales, or your Adobe authorized reseller.","Acrobat basics","1","More than just a PDF app., Contact our sales team."
"Adobe","https://www.adobe.com/acrobat/complete-pdf-solution.html","Does the trial give me access to the full version of Acrobat Pro?","Yes, the 7-day free trial includes all features and functionality of Acrobat Pro.","More than just a PDF app.","0","NA"
"Adobe","https://www.adobe.com/acrobat/complete-pdf-solution.html","How do I download and install my trial version of Acrobat Pro?","After clicking Start free trial from this web page, you will be asked to provide your email address. If you already have an Adobe ID, you'll be asked to sign in. Otherwise, follow steps to start your free trial.","More than just a PDF app.","0","NA"
"Adobe","https://www.adobe.com/acrobat/complete-pdf-solution.html","When does the trial period officially begin?","The trial period begins on the day you sign up and continues for 7 consecutive days. On the 8th day, payment will be collected unless you cancel previously. When the trial expires, you can still use Acrobat to view PDFs, comment, and fill out forms. To access all the features again, you will need to purchase Acrobat.","More than just a PDF app.","0","NA"
"Adobe","https://www.adobe.com/acrobat/complete-pdf-solution.html","I have an older version of Acrobat installed on my computer. What will happen to it if I install the trial version of Acrobat Pro?","Installation of the Acrobat Pro trial by default uninstalls any earlier version of Acrobat on Windows devices. If you choose to retain the existing Acrobat software on your machine, change the default by deselecting the Remove earlier version option in the Acrobat downloader UI. If you have uninstalled the previous version, then you can reinstall it when you are finished with the trial. Make sure you have your original serial number and installation files.","More than just a PDF app.","0","NA"
"Adobe","https://www.adobe.com/acrobat/complete-pdf-solution.html","Does it work for both Windows and Mac OS?","Yes, this trial is available for both Windows and Mac OS. Windows Intel or AMD processor; 1.5GHz or faster processorWindows 11 (64 bit), Windows 10 (32 bit and 64 bit) version 1809 or later, Windows 8, 8.1 (32 bit and 64 bit)?, Windows 7 SP1 (32 bit and 64 bit), or Windows Server - 2008 R2 (64 bit), 2012 (64 bit), 2012 R2 (64 bit), 2016 (64 bit), or 2019 (64 bit)2GB of RAM4.5GB of available hard-disk space1024x768 screen resolutionInternet Explorer 11, Firefox (ESR) (optional), Chrome (optional)Video hardware acceleration (optional) Mac Intel processor; M1 Apple Silicon processormacOS v10.14, macOS v10.15, macOS v11, or macOS v122GB of RAM2.75GB of available hard-disk space1024x768 screen resolutionSafari 10 or 11.0 (browser plug-in for Safari supported on 64-bit Intel processor only) Browser These requirements apply to the Acrobat Pro subscription plan and are in addition to the requirements listed above.Microsoft Windows 10, Windows 8, or Windows 7 using Internet Explorer 11, Firefox, or ChromemacOS v10.12 or later using Safari 10 or later, Firefox, or Chrome","More than just a PDF app.","0","NA"
"Adobe","https://www.adobe.com/acrobat/complete-pdf-solution.html","Can I get technical support or help during my trial period?","To get support during your free trial, visit the Adobe Customer Care page, where you can access a range of free information, including tutorials, forums, and expert advice.","More than just a PDF app.","1","Adobe Customer Care page"
"Adobe","https://www.adobe.com/acrobat/complete-pdf-solution.html","Can I continue to use Acrobat Reader during my Acrobat Pro trial period?","Acrobat Pro will be set as your default PDF viewer, but you can reset Reader as the default by opening Reader application and going to Edit > Preferences > General. Click the Select As Default PDF Handler button and follow the onscreen instructions.","More than just a PDF app.","0","NA"
"Adobe","https://www.adobe.com/acrobat/complete-pdf-solution.html","How do I uninstall my trial software?","Windows: To uninstall your trial version on a Windows device, close any open Adobe software on your computer, open the Windows Control Panel, and double-click Programs and Features. Click on Acrobat Pro, and select Uninstall from the menu. Mac OS: To remove the trial on a Mac, use the Acrobat Uninstaller in the /Applications/Adobe Acrobat Pro folder.","More than just a PDF app.","0","NA"
"Adobe","https://www.adobe.com/acrobat/complete-pdf-solution.html","What languages are supported?","The Acrobat desktop app is available in the following languages: EnglishFrenchGermanJapaneseItalianSpanishDutchBrazilian PortugueseSwedish DanishFinnishNorwegianSimplified ChineseTraditional ChineseKoreanCzechPolishRussian TurkishHungarianUkrainianSlovak'Slovenian'North African French'Middle Eastern HebrewõMiddle Eastern Arabicõ ? Available on Windows only.? The North African French (Fran‡ais) version is a French application user interface with Arabic/Hebrew right-to-left language support enabled by default.õ For Arabic and Hebrew, the application user interface is in English and Arabic/Hebrew right-to-left language support is enabled by default.","More than just a PDF app.","0","NA"
"Adobe","https://www.adobe.com/acrobat/complete-pdf-solution.html","Questions about business plans?","Contact us for more information about plans and pricing for businesses of all sizes.","More than just a PDF app.","1","Contact our sales team."
"Adobe","https://helpx.adobe.com/acrobat/faq.html","What is Adobe Acrobat Pro?","Adobe Acrobat Pro is a PDF solution with advanced tools for editing, converting, protecting, and signing documents. It includes software services across desktop, mobile, and web to keep you productive on the go. Using Acrobat Pro, you can: Create, edit, export, organize, and sign PDFs seamlessly across devices. Modify text and images intuitively on a desktop or tablet. Scan documents with your phone and edit them with automatic font matching. Secure your PDFs by creating high-quality files with restrictions to protect sensitive content. Convert PDFs to Word, Excel, or PowerPoint while maintaining formatting. Access and edit files from Dropbox, Google Drive, OneDrive, and more. Use smart autofill to quickly fill and sign forms. Remove sensitive data, such as confidential text, images, and metadata, for secured sharing. New and enhanced features are released occasionally. Check What's New in Acrobat to see the latest updates. For tutorials and feature guides, visit Adobe Acrobat Learn & Support.","Acrobat basics","1","What's new in Adobe Acrobat on desktop, Adobe Acrobat Learn & Support"
"Adobe","https://helpx.adobe.com/acrobat/faq.html","Why upgrade to an Acrobat Studio subscription?","An upgrade to the Acrobat Studio subscription gives you access to powerful cloud-based features in Acrobat Pro, unlimited access to AI Assistant and PDF Spaces, enhanced productivity options, and unlimited access to creation workflows powered by Adobe Express. Work smarter across devices Edit, convert, and sign PDFs on desktop, mobile, or web. Stay connected with Adobe cloud storage and 100GB of secure storage. Track, manage, and receive notifications for shared documents. Use AI Assistant and PDF Spaces to consolidate your files to ask questions, summarize content, compare documents, and create new material, all with the power of AI. Boost collaboration and efficiency Collect feedback with a single shared PDF link. View document status, send reminders, and cancel requests. Start SharePoint-based reviews on macOS. Microsoft SharePoint access is not included. Unlock insights quickly with PDF Spaces. Enhance editing and productivity Fill and sign forms faster with auto form recognition. Compare two PDFs instantly with the Compare files tool. Work more efficiently with multi-tab viewing and better text editing. Edit and generate images with more creative control, with the power of Adobe Express. Mobile and web benefits Create, edit, and organize PDFs on iOS or Android. Scan documents using your mobile camera. Check the Acrobat product comparison page to find the best purchase option for Adobe Acrobat.","Acrobat basics","1","Plans and pricing for Adobe Acrobat."
"Adobe","https://acrobat.adobe.com/us/en/pricing/pricing-compare-plans.html","What is Adobe Acrobat?","Acrobat is a productivity and collaboration platform that brings together powerful PDF tools, AI features, content creation, and seamless sharing to help you get your best work done. With an Acrobat desktop subscription, you get access to Acrobat desktop software, Acrobat online tools, the Acrobat Reader mobile app, and the Adobe Scan app ? all so you can work more securely and efficiently from almost anywhere, on any device.","Questions? We have answers.","0","NA"
"Adobe","https://acrobat.adobe.com/us/en/pricing/pricing-compare-plans.html","What's the difference between Acrobat Standard, Acrobat Pro, and Acrobat Studio?","Acrobat Standard includes basic PDF features, allowing you to: Edit and organize PDFs Convert documents to and from PDF Fill out forms, sign documents, and request e-signatures Password-protect files Acrobat Pro includes everything in Acrobat Standard, plus enhanced PDF tools and e-signature capabilities. With these advanced features, you can: Turn scanned documents into editable, searchable PDFs Compare PDFs to review differences Redact sensitive information from PDFs Brand your agreements by adding a logo and custom URL Create web forms and reusable e-sign templates Receive and track multiple e-signatures by sending in bulk Acrobat Studio includes everything in Acrobat Pro, plus AI Assistant for Acrobat and Adobe Express Premium. Additional features include: Chat with your documents and get fast answers Summarize documents with one click Ask questions using voice prompts on your mobile device Unlock insights across PDFs, Microsoft 365 files, and web links with PDF Spaces Easily create standout content with templates in Adobe Express Share a PDF Space with a prebuilt or personalized AI Assistant You can see how the Acrobat offerings compare.","Questions? We have answers.","1","Compare Acrobat plans."
"Adobe","https://acrobat.adobe.com/us/en/pricing/pricing-compare-plans.html","What's included in my Acrobat desktop subscription?","Your subscription to Acrobat includes desktop software, online access, and mobile apps, letting you effortlessly sync files across computers and devices. Acrobat desktop software: Use Acrobat on your desktop, with tools to edit, convert, protect, and sign documents. You can also integrate Acrobat with other productivity tools. Acrobat online: Use PDF and e-signature tools in any web browser. Our prebuilt integrations for Microsoft OneDrive, Google Drive, and more make it easy to store and share files online. You can even send documents for e-signature and track responses in real time. Acrobat Reader mobile app: The world's most trusted PDF reader and editor with more than 635 million installs. View, share, annotate, add comments, and sign documents ? all in one app. Acrobat Scan mobile app: Turn your mobile device into a powerful scanner that recognizes text automatically (OCR) and allows you to create, save, and organize your paper documents as digital files.","Questions? We have answers.","1","other productivity tools"
"Adobe","https://acrobat.adobe.com/us/en/pricing/pricing-compare-plans.html","How does a subscription work?","When you subscribe to Acrobat Studio, Acrobat Pro, or Acrobat Standard, you pay a monthly or annual fee based on the plan you choose. Regular updates will ensure you have the latest features available in Acrobat. You will not need to upgrade your product as long as your subscription is active.","Questions? We have answers.","0","NA"
"Adobe","https://acrobat.adobe.com/us/en/pricing/pricing-compare-plans.html","Is there a perpetual version of Acrobat available?","No. Adobe discontinued selling perpetual versions of Acrobat after Acrobat 2020. However, if you would like a non-subscription version of Acrobat, Acrobat Pro 2024 desktop software is a one-time, upfront purchase that provides three years of access to Acrobat desktop. It includes quarterly security updates but does not include Acrobat feature enhancements or access to Acrobat online services via your web browser and mobile devices.","Questions? We have answers.","1","Get 20+ Creative Cloud apps and Adobe Firefly creative AI., does not include Acrobat feature enhancements"
"Adobe","https://acrobat.adobe.com/us/en/pricing/pricing-compare-plans.html","What are the minimum system requirements to run Acrobat?","See the Acrobat system requirements page for information.","Questions? We have answers.","1","Acrobat system requirements page"
"Adobe","https://acrobat.adobe.com/us/en/pricing/pricing-compare-plans.html","In what languages is Acrobat available?","See the Acrobat system requirements page for information.","Questions? We have answers.","1","Acrobat system requirements page"
"Adobe","https://acrobat.adobe.com/us/en/pricing/pricing-compare-plans.html","What's the best way for my business to purchase Acrobat subscriptions?","Adobe offers plans for businesses of all sizes. For small businesses, Acrobat Teams subscriptions make it easy to purchase and manage multiple licenses through a centralized admin console. For larger organizations with more complex deployment and administrative needs, volume licensing options are available. Request a contact from Adobe's sales team, or contact an Adobe Authorized Reseller. To learn more, visit the Acrobat for business page.","Questions? We have answers.","1","Request a contact from Adobe's sales team, Solutions for businesses of all sizes."
"Adobe","https://acrobat.adobe.com/us/en/pricing/pricing-compare-plans.html","What makes Acrobat a great collaboration tool?","Acrobat gives you seamless and highly secure sharing, real-time commenting, and PDF tools that make collaborating on documents easier than ever. You can create knowledge hubs in PDF Spaces where the entire team can add files and work together to build strong work. Custom AI agents come in handy to help you guide AI Assistant to provide the direction and output you need to push your project forward.","Questions? We have answers.","0","NA"
"Adobe","https://acrobat.adobe.com/us/en/pricing/pricing-compare-plans.html","What's the best way to integrate document workflows with cloud storage?","The best way to integrate document workflows with cloud storage is by using Acrobat's built-in support for popular cloud services. Acrobat works seamlessly with: Acrobat Document Cloud: Access your files from anywhere, send links for review, and sync changes across devices. Third-party cloud storage: Connect to OneDrive, Google Drive, Dropbox, Box, and more directly within Acrobat. Users can open and save files from cloud storage without leaving Acrobat ? no need to download or upload manually. Real-time collaboration is enabled by sharing cloud-stored PDFs with others for commenting and review. Files can be organized and stored securely using version history and permission controls supported by your cloud provider.","Questions? We have answers.","0","NA"
"Adobe","https://acrobat.adobe.com/us/en/pricing/pricing-compare-plans.html","How can Acrobat automate my PDF tasks?","Acrobat helps automate your PDF workflows by streamlining repetitive tasks and reducing manual effort through built-in tools and integrations. Key automation features include: Action Wizard (in Acrobat Pro): Create and run custom sequences of tasks, like OCR, redaction, watermarking and file conversion on multiple PDFs at once. Batch processing: Apply the same edits, optimizations, or security settings across multiple documents automatically. Cloud-based workflows: Use Acrobat online and Adobe Document Cloud to send, sign, and track documents from anywhere with automated notifications and reminders. Integrations with Microsoft 365 and other apps: Automate PDF creation, editing, and signing directly within tools you already use. AI-powered features: Auto-tagging for accessibility, content recognition, and smart form field detection to reduce setup time.","Questions? We have answers.","0","NA"
"Adobe","https://acrobat.adobe.com/us/en/pricing/pricing-compare-plans.html","How do I streamline my document review process with Acrobat?","Acrobat makes it easy to manage and automate document review and collaboration, reducing the need for back-and-forth emails and manual edits. With Acrobat, you can: Share PDFs for review via a secure link, no attachments needed. Collect comments in one place, in real time, from multiple reviewers. Use automatic version tracking to keep everyone on the same page. Receive notifications when reviewers add feedback or complete their review. Work seamlessly with Microsoft Teams and Outlook to manage reviews within your existing workflow. Use AI Assistant to quickly review content and contracts, compare document versions, generate summaries, uncover insights and key data, and more.","Questions? We have answers.","0","NA"
"Adobe","https://helpx.adobe.com/acrobat/faq.html","Which products make up the Adobe Acrobat family of software?","Adobe Acrobat offers the following desktop, mobile, and web services supported by Adobe cloud storage: On desktop: Adobe Acrobat Studio Adobe Acrobat Pro Adobe Acrobat Standard (Windows only) Adobe Acrobat Reader On mobile: Adobe Acrobat Reader for Android, iOS, or Windows Phone Adobe Acrobat Sign for Android or iOS Adobe Scan for Android or iOS On web: Adobe Acrobat Studio Adobe Acrobat Pro Adobe Acrobat web extension (Google Chrome & Microsoft Edge) Adobe Acrobat on the web Check the Acrobat product comparison page to find the best purchase option for Adobe Acrobat.","Acrobat basics","1","More than just a PDF app., Simple tools. Powerful PDFs., Adobe Acrobat Reader, the original PDF solution., A mobile PDF experience built to keep business moving."
"Adobe","https://acrobat.adobe.com/us/en/products/pdf-reader.html","What is Adobe Acrobat Reader?","Adobe Acrobat Reader software is the free, trusted global standard for viewing, printing, signing, sharing, and annotating PDFs. It's the only PDF viewer that can open and interact with all types of PDF content ? including forms and multimedia. And now, it's connected to Adobe Document Cloud services ? so you can work with PDFs on any device, from anywhere.","Get Acrobat Reader, the original PDF solution., Questions? We have answers.","0","NA"
"Adobe","https://acrobat.adobe.com/us/en/products/pdf-reader.html","Is Acrobat Reader free?","Yes. Acrobat Reader is free desktop software available on the Reader download page or wherever you see the Get Adobe Acrobat Reader icon.","Get Acrobat Reader, the original PDF solution., Questions? We have answers.","1","Reader download page"
"Adobe","https://acrobat.adobe.com/us/en/products/pdf-reader.html","How do I download free Acrobat Reader desktop and mobile apps?","You can easily download free Adobe Acrobat Reader apps for multiple operating systems and devices: Desktop app: Visit the Acrobat Reader download page to get Reader for your desktop. Once there, you can select your language, operating system, and connection speed. Mobile app: To download this app, visit the Google Play or the Apple App Store. You can also download the latest version of the mobile app for Windows Phone devices.","Get Acrobat Reader, the original PDF solution., Questions? We have answers.","1","Acrobat Reader download page, Adobe Acrobat Reader pour PDF, A mobile PDF experience built to keep business moving., Windows Phone"
"Adobe","https://acrobat.adobe.com/us/en/products/pdf-reader.html","Do I need Acrobat Studio, Acrobat Pro, or Acrobat Standard to use Acrobat Reader?","No. Acrobat Reader is a free, stand-alone application that you can use to open, view, sign, print, annotate, search, and share PDF files. Acrobat Pro and Acrobat Standard are paid products that are part of the same family. See the Acrobat product comparison to explore the differences.","Get Acrobat Reader, the original PDF solution., Questions? We have answers.","1","Compare Acrobat plans."
"Adobe","https://acrobat.adobe.com/us/en/products/pdf-reader.html","What desktop operating system does Acrobat Reader support?","Acrobat Reader desktop software runs on both Windows and Mac operating systems. Download Reader desktop software now, or read system requirements.","Get Acrobat Reader, the original PDF solution., Questions? We have answers.","1","Download Reader desktop software, Technical requirements"
"Adobe","https://acrobat.adobe.com/us/en/products/pdf-reader.html","What languages does Acrobat Reader work in?","Learn about language support on the system requirements page.","Get Acrobat Reader, the original PDF solution., Questions? We have answers.","1","Technical requirements"
"Adobe","https://acrobat.adobe.com/us/en/products/pdf-reader.html","Is Acrobat Reader available on mobile devices?","Just like Reader on the desktop, Acrobat Reader for mobile is free and continues to offer the industry's most reliable mobile experience for viewing and interacting with PDFs. And now, with the addition of Adobe Document Cloud services, you can unlock premium features within the app to do more with PDFs when you purchase a subscription to Adobe Acrobat PDF Pack or Adobe Acrobat Export PDF? as well as Adobe Acrobat Pro. Visit the Google Play or the Apple App Store to get Android and iOS versions, respectively. You can also download the latest version of the mobile app for Windows Phone device.","Get Acrobat Reader, the original PDF solution., Questions? We have answers.","1","Your daily tasks won't change. The way you handle them will., Export all the PDFs you want., Do even more with your PDFs., Adobe Acrobat Reader pour PDF, A mobile PDF experience built to keep business moving."
"Adobe","https://acrobat.adobe.com/us/en/products/pdf-reader.html","What commenting tools are available in Acrobat Reader?","Reader makes it easy to annotate PDF documents. With Reader on your desktop, you can: annotate PDFs using sticky notes; type text directly onto the page; highlight, underline, or use strikethrough tools; and draw on the screen with the freehand drawing tool. The same commenting tools are also available in Acrobat Reader for mobile.","Get Acrobat Reader, the original PDF solution., Questions? We have answers.","0","NA"
