"site_name","url","question","answer","category","internal_link","link"
"DOCKER","https://www.docker.com/pricing/faq/","Who's required to pay for Docker subscription plans?","Each subscription plan clearly defines its features, usage limits, and costs. Customers who want access to any paid products or features must subscribe to a paid plan. For small companies with fewer than 250 employees AND less than $10M in revenue, Docker will continue to offer free usage of Docker Desktop only under the following terms: 4.2 Specific License Limitations for Standalone use of Docker Desktop. (a) The use of Docker Desktop without a paid Subscription, is further restricted(i) to your use for a non-commercial open source project and/or (ii) use in a commercial undertaking with fewer than 250 employees and less than US $10,000,000 (or equivalent local currency) in annual revenue. Government Entities shall not use Docker Desktop or access other Entitlements of the Service without purchasing a Subscription Docker's open-source software such as the Docker Engine is accessible for all and supported by the Moby project maintainers and community members.","Docker plans overview, Subscription","0","NA"
"DOCKER","https://www.docker.com/pricing/faq/","I am part of a ?Free Team? plan, what am I eligible for?","Free Team plans include unlimited public repos, one team, up to 3 seats, and 100 pulls/hr/user instead of 10 pulls/hr/IP address. They do not have access to Testcontainers Cloud, or Docker Build Cloud without upgrading to Pro, Team, or Business plan depending on requirements. Users on Free Team plans that wish to upgrade to the new paid plans can do so on December 10, 2024.","Docker plans overview, Subscription","0","NA"
"DOCKER","https://www.docker.com/pricing/faq/","Can I pay for the subscription plan and specific product consumption with an invoice?","Docker Team and Docker Business customers with 25 or more Users may purchase annual plans with an invoice by contacting sales. For business subscription plan customers, Docker's Sales team can also assist you in pre-purchasing consumption-based products (Build Cloud minutes, Scout Repos, Testcontainers Cloud runtime minutes, and Hub consumption) with an invoice.","Subscription, Billing","1","Let's get to know each other"
"DOCKER","https://www.docker.com/pricing/faq/","Do I get an invoice for the on-demand consumption?","For self-service purchases of a subscription plan, the on-demand consumption of a product will be charged to the credit card on file at the end of the monthly billing cycle and an invoice will be issued. For the sales-led purchase, an invoice will be issued to the customers at the end of the monthly billing cycle when on-demand consumption is incurred.","Subscription, Billing","0","NA"
"DOCKER","https://www.docker.com/pricing/faq/","What is the definition of ?an image pull??","An image pull includes both a version check and any images downloaded as a result of a pull request from either public or private repositories on Docker Hub.","Billing, Docker Hub","0","NA"
"DOCKER","https://www.docker.com/pricing/faq/","How do hourly Image pull rate limits work?","There is no hourly image pull rate limit for users or automated systems with a paid subscription. Docker Personal users using Docker Hub will experience hourly rate limits on image pull requests. For authenticated Personal users, there is a 100 pull/hour rate limit per user; for unauthenticated users, there is a 10 pull/hour rate limit per IP address. For more information on image pull rates, please visit this doc.","Billing, Docker Hub","1","Docker Hub usage and limits"
"DOCKER","https://www.docker.com/pricing/faq/","Can I still pay for a Service Account?","As of December 10th, 2024, Docker will no longer offer Service Accounts as an add-on for customers on new plans. Existing Service Account agreements will be honored until their current term expires.","Billing, Docker Hub","0","NA"
"DOCKER","https://www.docker.com/pricing/faq/","Can I still buy the IP Allowlist offering?","Docker is phasing out the IP Allowlisting feature as a standard offer. Existing contracts will be honored, and any new purchases need to be reviewed on a case-by-case basis. Docker will work with customers to find suitable alternatives for their use cases where possible.","Billing, Docker Hub","0","NA"
"DOCKER","https://www.docker.com/pricing/faq/","Do I still have access to the Autobuild service?","Yes, you will still have access to the Autobuild service.","Billing, Docker Hub","0","NA"
"DOCKER","https://www.docker.com/pricing/faq/","What will the impact be to Docker Sponsored Open Source (DSOS)?","The Docker Sponsored Open Source program will continue on as is, including all resources described in the docs page: https://docs.docker.com/trusted-content/dsos-program/ A key benefit of our DSOS program has always been fewer restrictions on rate limits for those projects that qualify. This will continue to be the case and we will be expanding DSOS resources to ensure ongoing coverage as new projects become popular. Looking to apply to join DSOS? The program is ideal for developers working on projects without a path to commercialization: https://www.docker.com/community/open-source/application/","Billing, Docker Hub","1","Docker-Sponsored Open Source Program, Docker Sponsored Open Source Program"
"DOCKER","https://docs.docker.com/trusted-content/dsos-program/","Who's eligible for the Docker-Sponsored Open Source program?","To qualify for the program, a publisher must share the project namespace in public repositories, meet the Open Source Initiative definition, and be in active development with no pathway to commercialization.","Docker-Sponsored Open Source Program","1","the Open Source Initiative definition, Docker Sponsored Open Source Program"
"DOCKER","https://www.docker.com/pricing/faq/","What is a builder?","A builder is a build engine that you can use to run your builds. Each subscription plan comes with a default builder configuration. Contact sales if you need additional CPUs, Cache, RAM, IOPs, or builders. For more information on builders, visit ??https://docs.docker.com/build/builders/.","Docker Hub, Docker Build Cloud","1","Builders"
"DOCKER","https://www.docker.com/pricing/faq/","What is the definition of a ?build minute??","?Build Minutes? refers to the amount of minutes used by the builders to access Docker Build Cloud whether from a user or automated system.","Docker Hub, Docker Build Cloud","0","NA"
"DOCKER","https://www.docker.com/pricing/faq/","How do I pay for ?build minutes??","All paid subscriptions receive an amount of build minutes included each month. These included minutes do not rollover. Customers can pre-purchase additional build minutes either through self-serve or by contacting your sales rep. There is no on-demand consumption available at this time.","Docker Hub, Docker Build Cloud","0","NA"
"DOCKER","https://www.docker.com/pricing/faq/","Can I buy more than 20,000 minutes?","Yes. Customers can pre-purchase additional minutes in several different fixed increments from 500 to 20,000 minutes. There is no limit to how many minutes a customer can pre-purchase. Customers can pre-purchase as many buckets of 20,000 minutes as they want.","Docker Hub, Docker Build Cloud","0","NA"
"DOCKER","https://www.docker.com/pricing/faq/","When will the pre-purchased build minutes expire?","All pre-purchased consumption expires at the end of a customer's subscription term which can be monthly, annually or other agreed term.","Docker Hub, Docker Build Cloud","0","NA"
"DOCKER","https://www.docker.com/pricing/faq/","What will happen if I use up my build limits? Will service be disrupted immediately?","If the minutes are used up in the middle of a build or builds, the service will not be interrupted. No new image builds can be executed unless additional minutes are pre-purchased.","Docker Hub, Docker Build Cloud","0","NA"
"DOCKER","https://www.docker.com/pricing/faq/","Can I try Build Cloud without a paid subscription?","If you do not have a Docker subscription, you may sign up for a free Personal account, which comes with a free trial for Docker Build Cloud.","Docker Hub, Docker Build Cloud","1","free trial"
"DOCKER","https://www.docker.com/pricing/faq/","How do I know how many minutes to buy?","Customers can get an idea of their total consumption needs by analyzing usage patterns from the included build minutes in their trial or paid plan.","Docker Hub, Docker Build Cloud","0","NA"
"DOCKER","https://www.docker.com/pricing/faq/","Do I get an alert when I am over the limit of purchased consumption?","Customers can view their usage at any time by visiting build.docker.com and logging in to their account. From there, consumption notifications can be modified under Settings & Billing. Select ?Consumption notifications? to specify which users will receive notifications and when notifications are sent.","Docker Hub, Docker Build Cloud","0","NA"
"DOCKER","https://www.docker.com/pricing/faq/","Can I disable Docker Build Cloud?","Yes. The Hub organization owner or admin can disable the service for the organization. Please refer to this doc for more info.","Docker Hub, Docker Build Cloud","1","Manage Docker products"
"DOCKER","https://www.docker.com/pricing/faq/","What is a ?Scout-enabled repository? and how are they counted?","A ?Scout-enabled repository? is an image repository that has been explicitly enabled for Scout's advanced image analysis. Plan limits relating to Scout-enabled repositories refer to a maximum number of repositories that can be enabled with Docker Scout at any point in time.For more information, please refer to this doc.","Docker Build Cloud, Docker Scout","1","Docker Scout image analysis"
"DOCKER","https://www.docker.com/pricing/faq/","How do I pay for additional Scout-enabled repositories?","Personal and Pro users have access to 1 and 2 Scout-enabled repositories respectively. Those customers can access an unlimited number of Scout-enabled repositories by upgrading to a Team or Business plan.","Docker Build Cloud, Docker Scout","0","NA"
"DOCKER","https://www.docker.com/pricing/faq/","How do I know how many repositories are Scout-enabled?","Please visit https://scout.docker.com/settings/repos. The repositories view provides real-time data on how many Scout-enabled repositories are enabled compared to your plan's limit.","Docker Build Cloud, Docker Scout","1","Sign in"
"DOCKER","https://www.docker.com/pricing/faq/","Can I disable the Docker Scout product access?","Yes. The owner and administrators of the Hub organization can delete the Scout account to disable the service access in their Hub organization. Please refer to our docs for more info.","Docker Build Cloud, Docker Scout","1","Manage Docker products"
"DOCKER","https://www.docker.com/pricing/faq/","What is the definition of ?worker minute??","Worker minute is a unit of measurement of usage on Testcontainers Cloud on through both desktop and CI use cases.","Docker Scout, Docker Testcontainers Cloud","0","NA"
"DOCKER","https://www.docker.com/pricing/faq/","How do I pay for additional Cloud Runtime minutes?","Customers can pre-purchase minutes through sales only. Without pre-purchase, all usage will be charged automatically to the account at the end of each monthly billing cycle. All paid subscriptions receive an amount of minutes included each month. These included minutes do not rollover. Customers can pre-purchase additional minutes by contacting their sales reps. If no minutes have been pre-purchased, customers will be billed for minutes exceeding their plan limits at the end of each monthly billing cycle at the on-demand rate.","Docker Scout, Docker Testcontainers Cloud","0","NA"
"DOCKER","https://www.docker.com/pricing/faq/","When does pre-purchased consumption expire?","Customers are free to purchase any amount of consumption at any time during the subscription term. All pre-purchased consumption expires at the end of the subscription term, which can be monthly, annually or other agreed term.","Docker Scout, Docker Testcontainers Cloud","0","NA"
"DOCKER","https://www.docker.com/pricing/faq/","Can I try Testcontainers Cloud without a paid subscription?","If you do not have a paid Docker subscription, you may sign up for a free Personal account which gives you a free trial for Testcontainers Cloud.","Docker Scout, Docker Testcontainers Cloud","1","free trial"
"DOCKER","https://www.docker.com/pricing/faq/","How do I know how much I have used?","Users can see their usage on the https://app.testcontainers.cloud/dashboard/billing page. We send monthly invoices that contain the number of worker minutes/seats used in the previous month.","Docker Scout, Docker Testcontainers Cloud","1","https://app.testcontainers.cloud/dashboard/billing"
"DOCKER","https://www.docker.com/pricing/faq/","How do I upgrade from the free Docker Personal Plan to any of the paid Docker plans?","Customers can perform upgrades through both self-service and sale-led purchase methods available to each plan.","Docker Testcontainers Cloud, Renewal, Expansion and Account Change","0","NA"
"DOCKER","https://www.docker.com/pricing/faq/","Can I upgrade from Docker Pro to the Docker Team plan?","Yes. Customers can perform upgrades through self-service.","Docker Testcontainers Cloud, Renewal, Expansion and Account Change","0","NA"
"DOCKER","https://www.docker.com/pricing/faq/","How do I upgrade from Docker Team to the Docker Business plan?","Customers can perform upgrades through both self-service and sales-led purchase methods.","Docker Testcontainers Cloud, Renewal, Expansion and Account Change","0","NA"
"DOCKER","https://www.docker.com/pricing/faq/","I am part of a ?Free Team? plan, how can I subscribe to any of the new Docker subscription plans?","Free Team plans may subscribe to a paid Team or Business plan through both self-service and sale-led purchase methods available.","Docker Testcontainers Cloud, Renewal, Expansion and Account Change","0","NA"
"DOCKER","https://www.docker.com/pricing/faq/","Do I need to do anything at the end of a subscription plan?","For all self-serve subscriptions, the plan will be automatically renewed at the end of the subscription period. Self-serve customers can cancel their subscription at any time prior to the renewal date, but are not subject to refunds outside of a 15-day window.","Docker Testcontainers Cloud, Renewal, Expansion and Account Change","0","NA"
"DOCKER","https://www.docker.com/pricing/faq/","Can I downgrade from the Docker Business plan to the Docker Team plan?","Yes. With the downgrade, you will lose the additional entitlements associated with a Business plan, your team will only have one Hub organization with only one Hub namespace, and your team size will be limited and you will not be able to use SSO to manage users or log in, and many more enterprise-grade security and governance features. You must contact the Docker Sales and Support team to complete the downgrade process.","Docker Testcontainers Cloud, Renewal, Expansion and Account Change","0","NA"
"DOCKER","https://www.docker.com/pricing/faq/","Can I downgrade from Docker Business or Team plans to Docker Pro plan?","No. The Pro plan does not include the support of the Hub organization and only allows a single user usage. The customers can decide to stay on the Team plan with a minimum one user or cancel the subscription at the end of the subscription period.","Docker Testcontainers Cloud, Renewal, Expansion and Account Change","0","NA"
"DOCKER","https://www.docker.com/pricing/faq/","What is Docker's Minimum Order Quantity (MOQ) policy and who is it for?","Our MOQ policy applies to contracted customers as follows: New Docker Business or Teams Annual Customers: A minimum purchase of 25 seats is required for new customers.Existing Docker Business or Team Annual Amendments: A minimum of 10 additional seats must be purchased for existing customers. Marketplace, Partner Resellers, and/or Distributors: The same MOQ requirements for new and existing business (25 seats for new, 10 for existing) apply to purchases made through our partner ecosystem.","Docker Testcontainers Cloud, Renewal, Expansion and Account Change","0","NA"
"NVIDIA","https://www.nvidia.com/en-us/geforce-now/faq/","What is GeForce NOW?","GeForce NOW is NVIDIA's cloud-based game streaming service, delivering real-time gameplay straight from the cloud to your laptop, desktop, Mac, Chromebook, SHIELD TV, select Samsung and LG TVs, iPhone, iPad, Android devices, Steam Deck, VR headsets, and more. Connect to your store accounts and stream your own library of games, or play your favorite free-to-play games. With cloud saves for supported games, you can pick up your game where you left off, on any supported device, wherever you are. #container-c9efe5f9b4 { } /* Mobile: up to 639px */ @media only screen and (max-width: 639px) { #container-c9efe5f9b4 { } } /* Tablet: 640px to 1023px */ @media only screen and (min-width: 640px) and (max-width: 1023px) { #container-c9efe5f9b4 { } } /* Laptop: 1024px to 1349px */ @media only screen and (min-width: 1024px) and (max-width: 1349px) { #container-c9efe5f9b4 { } } /* Desktop: 1350px and up */ @media only screen and (min-width: 1350px) { #container-c9efe5f9b4 { } }","General Questions","0","NA"
"NVIDIA","https://www.nvidia.com/en-us/geforce-now/faq/","Where is GeForce NOW available?","GeForce NOW is currently available from NVIDIA in North America, Europe, Japan, and through GeForce NOW Alliance partners in other parts of the world. Visit the server status page for a list of available servers and their current status. #container-3eb6cbff5d { } /* Mobile: up to 639px */ @media only screen and (max-width: 639px) { #container-3eb6cbff5d { } } /* Tablet: 640px to 1023px */ @media only screen and (min-width: 640px) and (max-width: 1023px) { #container-3eb6cbff5d { } } /* Laptop: 1024px to 1349px */ @media only screen and (min-width: 1024px) and (max-width: 1349px) { #container-3eb6cbff5d { } } /* Desktop: 1350px and up */ @media only screen and (min-width: 1350px) { #container-3eb6cbff5d { } }","General Questions","1","GEFORCE NOW SERVICE STATUS"
"NVIDIA","https://www.nvidia.com/en-us/geforce-now/faq/","How do I join GeForce NOW, and how much does it cost?","Visit our membership page and choose your preferred membership option. GeForce NOW offers three membership options including Performance and Ultimate with instant access to the best available GeForce gaming experience in the cloud. Day passes are also available for those looking to experience Premium benefits, without a monthly commitment. #container-3b841b0491 { } /* Mobile: up to 639px */ @media only screen and (max-width: 639px) { #container-3b841b0491 { } } /* Tablet: 640px to 1023px */ @media only screen and (min-width: 640px) and (max-width: 1023px) { #container-3b841b0491 { } } /* Laptop: 1024px to 1349px */ @media only screen and (min-width: 1024px) and (max-width: 1349px) { #container-3b841b0491 { } } /* Desktop: 1350px and up */ @media only screen and (min-width: 1350px) { #container-3b841b0491 { } }","General Questions","1","Your Power Play Starts Here"
"NVIDIA","https://www.nvidia.com/en-us/geforce-now/premium-memberships/","How would you rate your overall website experience?","How would you rate your overall website experience?1234567Very dissatisfiedVery satisfiedNext","Try Before You Subscribe, Get The Latest GeForce NOW News","0","NA"
"NVIDIA","https://www.nvidia.com/en-us/geforce-now/faq/","What games are available?","GeForce NOW supports two types of games to give you the widest choice of titles possible. Over 2,300 Ready-to-Play games are available to stream instantly and always kept up to date. They're tested for a seamless experience. In addition, premium members have access to Install-to-Play games, which they can install, download and play an additional 2,200+ Steam games that have opted-in to Steam Cloud Gaming by the game publisher, with more to be added each week. Learn more about Install-to-Play, or visit the GeForce NOW games page to see which games are currently available. #container-4aef285df2 { } /* Mobile: up to 639px */ @media only screen and (max-width: 639px) { #container-4aef285df2 { } } /* Tablet: 640px to 1023px */ @media only screen and (min-width: 640px) and (max-width: 1023px) { #container-4aef285df2 { } } /* Laptop: 1024px to 1349px */ @media only screen and (min-width: 1024px) and (max-width: 1349px) { #container-4aef285df2 { } } /* Desktop: 1350px and up */ @media only screen and (min-width: 1350px) { #container-4aef285df2 { } }","General Questions","1","Steam Cloud Gaming, Install-to-Play, Game On. 4000+ Games Waiting in the Cloud."
"NVIDIA","https://www.nvidia.com/en-us/geforce-now/faq/","Do I need to own games?","Yes, you need to own or purchase a game from one of the supported game stores before playing it on GeForce NOW. The service also supports hundreds of the most popular free-to-play games. #container-bc8b27f869 { } /* Mobile: up to 639px */ @media only screen and (max-width: 639px) { #container-bc8b27f869 { } } /* Tablet: 640px to 1023px */ @media only screen and (min-width: 640px) and (max-width: 1023px) { #container-bc8b27f869 { } } /* Laptop: 1024px to 1349px */ @media only screen and (min-width: 1024px) and (max-width: 1349px) { #container-bc8b27f869 { } } /* Desktop: 1350px and up */ @media only screen and (min-width: 1350px) { #container-bc8b27f869 { } }","General Questions","0","NA"
"NVIDIA","https://www.nvidia.com/en-us/geforce-now/faq/","Why are some games available in other countries but I cannot play them?","GeForce NOW follows local content-rating agencies. We try to have all supported games available in all countries, but some games are prohibited in some countries. Visit our supported games page to see which titles are available. #container-dd1f1aee1b { } /* Mobile: up to 639px */ @media only screen and (max-width: 639px) { #container-dd1f1aee1b { } } /* Tablet: 640px to 1023px */ @media only screen and (min-width: 640px) and (max-width: 1023px) { #container-dd1f1aee1b { } } /* Laptop: 1024px to 1349px */ @media only screen and (min-width: 1024px) and (max-width: 1349px) { #container-dd1f1aee1b { } } /* Desktop: 1350px and up */ @media only screen and (min-width: 1350px) { #container-dd1f1aee1b { } }","General Questions","1","Game On. 4000+ Games Waiting in the Cloud."
"NVIDIA","https://www.nvidia.com/en-us/geforce-now/faq/","I'm having an issue while streaming a game. Where can I get help?","You can work with a Customer Care agent here. Our product and support teams are ready to assist when they can. You can also send us feedback by pressing the exclamation icon in-app and share your feedback or discussing your issue with our GeForce NOW Community on our forums. #container-b15048d290 { } /* Mobile: up to 639px */ @media only screen and (max-width: 639px) { #container-b15048d290 { } } /* Tablet: 640px to 1023px */ @media only screen and (min-width: 640px) and (max-width: 1023px) { #container-b15048d290 { } } /* Laptop: 1024px to 1349px */ @media only screen and (min-width: 1024px) and (max-width: 1349px) { #container-b15048d290 { } } /* Desktop: 1350px and up */ @media only screen and (min-width: 1350px) { #container-b15048d290 { } }","General Questions","1","Support, GeForce Forums"
"NVIDIA","https://www.nvidia.com/en-us/geforce-now/faq/","I have a feature request, where can I post it?","You can use the Send Feedback tool in the GeForce NOW app to share your feature requests and feedback. Our product and support teams read all feedback submitted, and your input helps drive new features and additions. #container-f16ec23f1a { } /* Mobile: up to 639px */ @media only screen and (max-width: 639px) { #container-f16ec23f1a { } } /* Tablet: 640px to 1023px */ @media only screen and (min-width: 640px) and (max-width: 1023px) { #container-f16ec23f1a { } } /* Laptop: 1024px to 1349px */ @media only screen and (min-width: 1024px) and (max-width: 1349px) { #container-f16ec23f1a { } } /* Desktop: 1350px and up */ @media only screen and (min-width: 1350px) { #container-f16ec23f1a { } }","General Questions","0","NA"
"NVIDIA","https://www.nvidia.com/en-us/geforce-now/faq/","What are the minimum requirements, including internet speed, to play GeForce NOW?","Please visit the System Requirements page for info on system requirements, including internet speed. #container-d576bd61ee { } /* Mobile: up to 639px */ @media only screen and (max-width: 639px) { #container-d576bd61ee { } } /* Tablet: 640px to 1023px */ @media only screen and (min-width: 640px) and (max-width: 1023px) { #container-d576bd61ee { } } /* Laptop: 1024px to 1349px */ @media only screen and (min-width: 1024px) and (max-width: 1349px) { #container-d576bd61ee { } } /* Desktop: 1350px and up */ @media only screen and (min-width: 1350px) { #container-d576bd61ee { } }","General Questions","1","System Requirements"
"NVIDIA","https://www.nvidia.com/en-us/geforce-now/faq/","What membership options are available for GeForce NOW?","GeForce NOW offers three membership plans: Free, Performance, and Ultimate. You can sign up here. Day passes are also available for those looking to experience premium benefits, without a monthly commitment. #container-de5b4f8b8b { } /* Mobile: up to 639px */ @media only screen and (max-width: 639px) { #container-de5b4f8b8b { } } /* Tablet: 640px to 1023px */ @media only screen and (min-width: 640px) and (max-width: 1023px) { #container-de5b4f8b8b { } } /* Laptop: 1024px to 1349px */ @media only screen and (min-width: 1024px) and (max-width: 1349px) { #container-de5b4f8b8b { } } /* Desktop: 1350px and up */ @media only screen and (min-width: 1350px) { #container-de5b4f8b8b { } }","General Questions, Memberships","1","GeForce NOW"
