"site_name","url","question","answer","category","internal_link","link"
"SAP","https://www.sap.com/belgique/about/legal/privacy.html","How long does SAP retain your personal data?","SAP may retain your Personal Data for an additional period to comply with legal obligations that apply to the processing of your Personal Data or if it is necessary for SAP to assert its rights or defend against legal action. SAP will retain your Personal Data until the end of the applicable retention period or until the legal action is terminated. SAP retains your Personal Data for as long as necessary: ??to make available to you the products and services that you or your employer have requested; to develop products or services. Such processing may continue as long as it is necessary or if SAP becomes aware of developments in your relationship with the SAP customer; to fulfill SAP's legitimate operational purposes as described in this privacy statement, unless you object to SAP's use of your Personal Data for such purposes; to comply with legal obligations to retain Personal Data, including those arising from applicable export, financial, tax or trade laws ;until you revoke a consent previously given to SAP for the processing of your Personal Data.","SAP Privacy Statement","0","NA"
"SAP","https://www.sap.com/belgique/about/legal/privacy.html","Who are the recipients of your personal data?","SAP Group: Members of the SAP Group may also receive or have access to personal data to centrally manage internal services within the group and on behalf of SAP SE, to provide support to other members of the SAP Group, or when personal data is transferred to them in accordance with a relevant legal basis. In such cases, said members will use personal data for the same purposes and under the same conditions as described in this privacy statement. If you would like to know which member of the SAP Group is responsible for the business relationship with you or your employer, please contact us at webmaster[@]sap.com. Third-party service providers: SAP may engage third-party service providers to process personal data on behalf of SAP, for example for consulting or other services, providing the website, creating and providing SAP offers or sending newsletters. Such service providers may receive or be granted access to personal data in connection with the performance of their services and will be recipients within the meaning of applicable data protection legislation, including the GDPR. SAP Partners: With your consent or at your request, including to carry out services ordered by you, SAP may share your personal data with designated partner companies in order to provide you with the requested product or service. Other third parties: With your consent or At your request, SAP may transfer your registration data to the companies listed on the registration page for an SAP seminar, webinar or event. These companies may receive your personal data as co-organizers or sponsors of the event and will use your registration data for the purposes of their participation in the event. They will directly provide you with all the legally required information concerning the purposes of processing your data and the methods for exercising your rights.","SAP Privacy Statement","1","Data Sharing between specific SAP Group Companies"
"SAP","https://www.sap.com/belgique/about/legal/privacy.html","What are your data protection rights and how can you exercise them?","SAP respecte vos droits l‚gaux lorsqu'il s'agit de traiter vos donn‚es … caractŠre personnel. Dans la mesure pr‚vue par les lois applicables en matiŠre de protection des donn‚es, vous b‚n‚ficiez des droits suivants : Acc‚der … vos donn‚es … caractŠre personnel que nous avons sur vous ou les mettre … jour.Obtenir une copie des donn‚es … caractŠre personnel que vous avez fournies … SAP, dans la mesure o— SAP utilise vos donn‚es … caractŠre personnel sur la base de votre consentement ou pour conclure un contrat avec vous. Dans ce cas, reportez-vous … l'article ci-dessous ® Comment exercer vos droits en matiŠre de protection des donn‚es ? ¯. Veuillez noter que vous devrez pr‚ciser les informations ou les activit‚s de traitement auxquelles se rapporte votre demande, le format dans lequel vous souhaitez obtenir les donn‚es … caractŠre personnel, ainsi que le destinataire … qui elles doivent ˆtre transmises, qui peut ˆtre vous-mˆme ou un tiers. SAP examinera avec attention votre demande et vous communiquera les modalit‚s pour y r‚pondre du mieux possible.Supprimer vos donn‚es … caractŠre personnel que nous d‚tenons … votre sujet. Veuillez toutefois noter que SAP peut supprimer ou supprimera vos donn‚es … caractŠre personnel uniquement en l'absence d'une obligation l‚gale ou d'un droit prioritaire imposant ou permettant … SAP de les conserver. Si vous demandez … SAP de supprimer vos donn‚es … caractŠre personnel, vous pourriez ne plus ˆtre en mesure d'utiliser les services SAP qui n‚cessitent l'utilisation de telles donn‚es.Vous opposer au traitement ult‚rieur de vos donn‚es … caractŠre personnel par SAP si et dans la mesure o— SAP traite vos donn‚es … caractŠre personnel sur la base de son int‚rˆt l‚gitime. Lorsque vous vous opposez au traitement par SAP de vos donn‚es … caractŠre personnel, SAP examinera avec soin votre objection et cessera par la suite d'utiliser les informations concern‚es … moins qu'il n'existe des motifs imp‚rieux et l‚gitimes de SAP justifiant de continuer … utiliser les donn‚es … caractŠre personnel, et susceptibles de pr‚valoir sur le motif de votre objection, ou si SAP a besoin des informations en question pour faire valoir, exercer et d‚fendre ses droits en justice.Vous opposer aux activit‚s de marketing direct ou de profilage en rapport avec le marketing direct. SAP cessera imm‚diatement de traiter vos donn‚es … caractŠre personnel … des fins de marketing direct dŠs lors que vous aurez formul‚ une telle demande.R‚voquer votre consentement : lorsque SAP traite vos donn‚es … caractŠre personnel sur la base de votre consentement, vous pouvez … tout moment retirer votre consentement en vous d‚sinscrivant ou en nous envoyant un avis de r‚tractation. En cas de retrait du consentement, SAP ne traitera plus les donn‚es … caractŠre personnel soumises audit consentement, sauf si la loi l'exige ou l'autorise (par exemple, si SAP a besoin de vos donn‚es … caractŠre personnel pour faire valoir ses droits ou se d‚fendre contre toute action en justice). Si SAP est tenue de ou autoris‚e … conserver vos donn‚es … caractŠre personnel pour d'autres motifs l‚gaux, vos donn‚es … caractŠre personnel ne feront pas l'objet d'autres traitements et seront uniquement conserv‚es pendant la dur‚e requise par la loi ou n‚cessaire pour atteindre l'autre finalit‚. N‚anmoins, un retrait du consentement n'a aucun effet sur les traitements ant‚rieurs des donn‚es … caractŠre personnel r‚alis‚s par SAP jusqu'au moment de votre r‚tractation. En outre, si votre utilisation d'une offre SAP exige votre consentement pr‚alable, SAP ne sera plus en mesure de vous procurer le service, l'offre ou l?‚v‚nement concern‚ aprŠs la r‚vocation de votre consentement.Ne pas ˆtre soumis … une d‚cision bas‚e uniquement sur des moyens automatis‚s, si la d‚cision produit des effets juridiques vous concernant ou vous affecte de fa‡on significative de la mˆme maniŠre.Demander … SAP de cesser tout traitement ult‚rieur de vos donn‚es … caractŠre personnel dans les cas suivants :vous d‚clarez que les donn‚es … caractŠre personnel d‚tenues … votre sujet sont incorrectes, sous r‚serve du d‚lai n‚cessaire … SAP pour v‚rifier l'exactitude des donn‚es … caractŠre personnel concern‚es ;il n'existe aucune base juridique permettant le traitement de vos donn‚es … caractŠre personnel par SAP, et vous exigez que SAP mette fin … leur traitement ;SAP n'a plus besoin de conserver vos donn‚es … caractŠre personnel, mais vous d‚clarez demander … SAP de les conserver afin de faire valoir ou d'exercer des droits juridiques ou d'assurer votre d‚fense contre des recours de tiers ; ouvous vous opposez au traitement de vos donn‚es … caractŠre personnel par SAP sur la base d'un int‚rˆt l‚gitime de SAP, sous r‚serve du temps n‚cessaire … SAP pour d‚terminer s'il existe un int‚rˆt sup‚rieur ou une obligation juridique n‚cessitant le traitement de vos donn‚es … caractŠre personnel. D‚poser une plainte auprŠs de l'autorit‚ de contr“le comp‚tente si vous n?ˆtes pas satisfait de la maniŠre dont SAP traite vos donn‚es … caractŠre personnel. L'autorit‚ de contr“le comp‚tente de votre r‚gion est d‚finie dans l'article sp‚cifique au pays ci-dessous. En fonction des lois locales applicables en matiŠre de protection des donn‚es, vos droits peuvent faire l'objet de d‚rogations, de limitations ou d'exceptions, tel que stipul‚ dans l'article sp‚cifique au pays ci-dessous. Veuillez noter que SAP respecte vos droits l‚gaux en matiŠre de traitement de vos donn‚es … caractŠre personnel dans la mesure pr‚vue par les lois applicables en matiŠre de protection des donn‚es. Comment exercer vos droits en matiŠre de protection des donn‚es ? Si vous voulez vous d‚sabonner des communications commerciales SAP, envoyez un e-mail … l'adresse webmaster[@]sap.com. SAP prendra les mesures n‚cessaires pour v‚rifier votre identit‚ avec un degr‚ raisonnable de certitude avant de traiter le droit … la protection des donn‚es que vous souhaitez exercer. Dans la mesure du possible, SAP comparera les donn‚es … caractŠre personnel que vous avez fournies lors de la soumission d'une demande d'exercice de vos droits avec les informations d‚j… g‚r‚es par SAP. Une telle op‚ration peut notamment impliquer la comparaison de deux points de donn‚es ou plus fournis lors de la soumission de votre demande avec deux points de donn‚es ou plus d‚j… g‚r‚s par SAP. SAP refusera de traiter les demandes manifestement infond‚es, excessives, frauduleuses, repr‚sent‚es par des tiers sans repr‚senter d–ment l'autorit‚ respective, ou sans autre lien avec les dispositions du droit local. Prise de d‚cision automatis‚e Les d‚cisions automatis‚es sont d‚finies comme des d‚cisions concernant des personnes qui reposent uniquement sur le traitement automatis‚ de donn‚es … caractŠre personnel et qui produisent des effets juridiques affectant de maniŠre significative les personnes impliqu‚es (® Prise de d‚cision automatis‚e ¯). SAP a recours … une Prise de d‚cision automatis‚e uniquement si n‚cessaire pour ex‚cuter ou conclure un contrat, sur la base de votre consentement explicite ou si une loi autorise sp‚cialement une Prise de d‚cision automatis‚e pour un traitement donn‚. Les ‚l‚ments suivants sont pris en compte dans la Prise de d‚cision automatis‚e de SAP : Les cat‚gories de donn‚es utilis‚es dans le processus de profilage ou de prise de d‚cisionLes raisons pour lesquelles ces cat‚gories sont consid‚r‚es comme pertinentesLes modalit‚s de cr‚ation du profil utilis‚ dans le processus de prise de d‚cision automatis‚e, y compris les statistiques utilis‚es dans l'analyseLes raisons pour lesquelles ce profil est pertinent pour le processus de prise de d‚cision automatis‚eLa maniŠre dont il est utilis‚ pour une d‚cision concernant la personne concern‚eLe fait que le traitement automatis‚ est en place et que la personne concern‚e peut obtenir une intervention humaine si elle n'est pas satisfaite du r‚sultat","SAP Privacy Statement","0","NA"
"SAP","https://www.sap.com/belgique/about/legal/privacy.html","Can you use SAP Services as a minor?","As a general rule, SAP websites and online services are not intended for users under the age of 16 or the equivalent minimum age in the applicable jurisdiction. If you are under 16 years of age, you may not register with or use the Websites or Online Services.","SAP Privacy Statement","0","NA"
"SAP","https://www.sap.com/belgique/about/company/faq.html","What is SAP's commitment to human rights and labor standards?","As a signatory of the UN Global Compact since 2000, SAP believes companies have a responsibility to respect human rights throughout all business operations. SAP is committed to respecting and promoting human rights across our operations, extended supply chain, and product lifecycle. We set high standards of fairness, diversity, and inclusion for ourselves, and expect all of our business partners to respect human rights and avoid complicity in any abuse. We take guidance from the UN Guiding Principles on Business and Human Rights as well as legal requirements like the German Supply Chain Due Diligence Act (Lieferkettensorgfaltspflichtengesetz, LkSG), to operationalize our commitment. Further key References: SAP Integrated Report 2023, chapter Human RightsSAP Human Rights Commitment StatementSAP's Artificial Intelligence (AI) web site where you find SAP's Guiding Principles for Artificial Intelligence, the SAP Global AI Ethics Policy, and the AI Ethics HandbookSAP Supplier Code of Conduct","Sustainability","1","SAP believes companies have a responsibility to respect human rights, SAP Integrated Report 2023, SAP Global Human Rights Commitment Statement, SAP Human Rights Commitment Statement, SAP's Artificial Intelligence (AI) web site, SAP's Guiding Principles for Artificial Intelligence"
"SAP","https://www.sap.com/belgique/about/company/faq.html","Where do you report how and to what extent SAP activities are eligible and aligned with the EU Taxonomy?","Please see our Integrated Report for related disclosures.","Sustainability","1","SAP Integrated Report 2023"
"SAP","https://www.sap.com/belgique/about/company/faq.html","How does SAP contribute to the 17 UN Sustainable Development Goals (SDGs)?","SAP embraces the 17 UN Sustainable Development Goals (SDGs) and embedded the framework as a foundation to our strategic approach to sustainability. We use this framework to evaluate global progress ? both for our roles as a role model and exemplar and as an enabler. Our contribution to the SDGs is a cross-company effort driven by experts from almost every board area and aligned through the internal SDG Network. Engagement with customers and other activities contributing to the SDGs are addressed in our Integrated Report, where we describe the potential positive and negative direct or indirect impacts of our company and of our products and services related to the SDGs.","Sustainability","1","SAP Integrated Report 2023"
"SAP","https://www.sap.com/belgique/about/company/faq.html","Are any of SAP's institutional investors classified as socially responsible investors (SRIs)?","About 43% of SAP's institutional investors are classified as SRIs. Learn more in the SAP Integrated Report.","Sustainability","1","SAP Integrated Report 2023"
"SAP","https://www.sap.com/belgique/about/company/faq.html","Is SAP listed on any sustainability ratings and rankings?","Yes, learn more about SAP's sustainability awards and recognitions here. You can also access SAP's ESG performance directly via the web sites of rating agencies such as: Sustainalytics: SAP scoring a low ESG risk ratingMSCI: AAA ratingRefinitiv (search for SAP SE): SAP scores 95/100Corporate Sustainability Assessment by S&P: SAP #1 as one of two companies in the software industry (see the 2023 Sustainability Yearbook)Corporate Knights: SAP listed in the Global 100 ranking of the world's most sustainable companies 2023","Sustainability","1","SAP approach to sustainability, Empower your investment decisions with a consistent approach to assess material ESG risks, ESG Ratings & Climate Search ToolExplore potential sustainability and climate risks and opportunities for over 10, 000 companies., Corporate Sustainability Assessment by S&P, SAP SE ESG Score"
"SAP","https://www.sustainalytics.com/esg-rating/sap-se/1008004721","What are the ESG Risk Ratings?","About ESG Risk Ratings  Learn more about ESG Risk Ratings Download Brochure How do the ESG Risk Ratings work? What are Material ESG Issues? Morningstar Sustainalytics is a trusted and reliable choice for investors who are looking for a streamlined methodology in assessing financially material ESG issues. Learn More","Empower your investment decisions with a consistent approach to assess material ESG risks, About ESG Risk Ratings","1","ESG Risk Ratings:, Understanding and Applying Sustainalytics' ESG Risk Ratings' Material ESG Issues."
"SAP","https://www.sustainalytics.com/esg-rating/sap-se/1008004721","How do the ESG Risk Ratings work?","About ESG Risk Ratings What are the ESG Risk Ratings? Learn more about ESG Risk Ratings Download Brochure  What are Material ESG Issues? Morningstar Sustainalytics is a trusted and reliable choice for investors who are looking for a streamlined methodology in assessing financially material ESG issues. Learn More","Empower your investment decisions with a consistent approach to assess material ESG risks, About ESG Risk Ratings","1","ESG Risk Ratings:, Understanding and Applying Sustainalytics' ESG Risk Ratings' Material ESG Issues."
"SAP","https://www.sustainalytics.com/esg-rating/sap-se/1008004721","What are Material ESG Issues?","About ESG Risk Ratings What are the ESG Risk Ratings? Learn more about ESG Risk Ratings Download Brochure How do the ESG Risk Ratings work?  Morningstar Sustainalytics is a trusted and reliable choice for investors who are looking for a streamlined methodology in assessing financially material ESG issues. Learn More","Empower your investment decisions with a consistent approach to assess material ESG risks, About ESG Risk Ratings","1","ESG Risk Ratings:, Understanding and Applying Sustainalytics' ESG Risk Ratings' Material ESG Issues."
"Salesforce","https://www.salesforce.com/campaign/lightning/faq/","I'm on Salesforce Classic for the time being. Is that okay?","Yes, but Lightning is the future of the Salesforce platform and user experience. It empowers our customers to move faster, do more, and be more productive through reimagined classic features and boosted features available only in Lightning Experience. DOWNLOAD THE FULL LIGHTNING EXPERIENCE FEATURES LIST All new Salesforce innovation is solely in Lightning. So we encourage each and every one of our customers to transition to Lightning Experience soon and start benefiting from everything Lightning has to offer. We're here to help! Check out the Lightning Experience Transition Tools for a one-stop shop to simplify your transition journey. LEARN MORE WITH THE TRANSITION TOOLS","Frequently Asked Questions (FAQ)","1","DOWNLOAD THE FULL LIGHTNING EXPERIENCE FEATURES LIST, The One-Stop Shop for Your Lightning Experience Transition"
"Salesforce","https://www.salesforce.com/form/lightning/lightning-features/?d=cta-body-promo-1","Ready to take the next step with the Agentforce 360 Platform?","Try Agentforce 360 Platform Services for 30 days. No credit card, no installations.","Agentforce and AI App Development, Keep up with the latest AI App Development trends, insights, and resources","0","NA"
"Salesforce","https://www.salesforce.com/form/lightning/lightning-features/?d=cta-body-promo-1","What is enterprise app development?","It's the process of creating software applications specifically designed to meet the complex needs of large organizations (enterprises). These applications are typically built to support business operations, improve productivity, streamline workflows, and ensure data security at scale.","Agentforce and AI App Development, Enterprise App Development FAQ","0","NA"
"Salesforce","https://www.salesforce.com/form/lightning/lightning-features/?d=cta-body-promo-1","What is Salesforce Enterprise App Development?","Salesforce Enterprise App Development involves using Salesforce's tools, frameworks, and APIs to design, build, and deploy apps that work natively with Salesforce's ecosystem (CRM, analytics, automation, etc.).","Agentforce and AI App Development, Enterprise App Development FAQ","0","NA"
"Salesforce","https://www.salesforce.com/campaign/lightning/faq/","Do I need to move my entire org all at once?","No, you don't have to move everyone at once. In fact, we recommend transitioning users in phases, starting with a small pilot, to keep the effort manageable and iterate on lessons learned. GET THE TOP 3 STRATEGIES FOR ROLLING OUT LIGHTNING EXPERIENCE E-BOOK","Frequently Asked Questions (FAQ)","1","GET THE TOP 3 STRATEGIES FOR ROLLING OUT LIGHTNING EXPERIENCE E-BOOK"
"Salesforce","https://www.salesforce.com/form/lightning/lightning-rollout-strategies/?d=cta-body-promo-2","What is enterprise application development?","In the past, the app development process was a slow and rigid process. Large teams worked with on-premise systems and followed a step-by-step, ?waterfall? method to building software. The process was often complicated and costly.","Enterprise Application Development: The Complete Guide","1","Agentforce and AI App Development, Exploring project management methodologies"
"Salesforce","https://www.salesforce.com/form/lightning/lightning-rollout-strategies/?d=cta-body-promo-2","When is enterprise app development needed?","Enterprise app development is important when your current tools, systems, and out-of-the-box applications can't keep up with the demands of your growing business. Whether you're scaling operations, improving customer experiences, or modernizing outdated processes, custom application development can bridge the gap.","Enterprise Application Development: The Complete Guide, What is enterprise application development?","1","Custom Application Development: The Complete Guide"
"Salesforce","https://www.salesforce.com/form/lightning/lightning-rollout-strategies/?d=cta-body-promo-2","How have modern platforms made app development more accessible?","Modern platforms have lowered the barriers to app development with features like low-code and no-code tools. These features allow business users, who may not have traditional programming skills, to create and customize applications using drag-and-drop interfaces. This accelerates the development process and makes it more inclusive.","Enterprise Application Development: The Complete Guide, Enterprise application development FAQs","0","NA"
"Salesforce","https://www.salesforce.com/form/lightning/lightning-rollout-strategies/?d=cta-body-promo-2","What are the key characteristics of an effective app development tool?","An effective app development tool should offer fast results through visual prototyping and easy testing, and it should include robust built-in security features to protect data. The tool must also be scalable to grow with the business and support new innovations like custom AI and advanced APIs.","Enterprise Application Development: The Complete Guide, Enterprise application development FAQs","0","NA"
"Salesforce","https://www.salesforce.com/form/lightning/lightning-rollout-strategies/?d=cta-body-promo-2","What are the three types of cloud services for app development?","The three main types of cloud services are Software as a Service (SaaS), Platform as a Service (PaaS), and Infrastructure as a Service (IaaS). SaaS provides ready-to-use software, PaaS offers a platform for building custom apps, and IaaS gives developers access to the fundamental computing infrastructure for scaling.","Enterprise Application Development: The Complete Guide, Enterprise application development FAQs","0","NA"
"Salesforce","https://www.salesforce.com/campaign/lightning/faq/","Will I need to create an entirely new org?","No, you don't have to create another org. All of your data and logic customizations will still work in Lightning Experience when you switch over.","Frequently Asked Questions (FAQ)","0","NA"
"Salesforce","https://www.salesforce.com/campaign/lightning/faq/","Does Lightning cost more?","No, it's just a better way to use Salesforce. To more quickly gain all the productivity benefits, plan your move to Lightning Experience. The Learning Map provides a curated set of resources to help you visualize the recommended steps and best practices in each phase of a Lightning Experience transition: Discover, Roll Out, and Optimize. Each phase includes a variety of links to business value content, transition tools, templates, videos, help content, and more! Check Out The Journey To Lightning Experience Learning Map","Frequently Asked Questions (FAQ)","1","Check Out The Journey To Lightning Experience Learning Map"
"Salesforce","https://www.salesforce.com/campaign/lightning/faq/","What is Lightning Experience vs. the Lightning Framework?","The Lightning Experience is a more productive, modern way for everyone to work. The Lightning Framework is an environment that radically speeds up how you customize Salesforce and build new apps. Learn more on the admin page","Frequently Asked Questions (FAQ)","1","Learn more on the admin page"
"Salesforce","https://www.salesforce.com/campaign/lightning/faq/","Is there a Lightning community where I can ask more questions?","Yes, there is, full of admins and devs. You can meet experts, ask questions, and get answers from an entire community of people ready to help. Visit the Salesforce Success Community now","Frequently Asked Questions (FAQ)","1","Visit the Salesforce Success Community now"
